{"assumptions":["PM-ASSUMPTION-6001"],"evidence":["PM-EVIDENCE-6002"],"id":"PM-CLAIM-6003","limitations":["PM-LIMITATION-6001","PM-LIMITATION-6002"],"owner":"ITDO Inc.","record_type":"claim","reviewers":["synthetic-fixture-reviewer"],"schema_version":"0.1","scope":"Identifier and digest binding for the public synthetic fixture only.","statement":"The fixture manifest references the reviewed Protocol and conformance identifiers.","status":"supported-with-assumptions","status_reason":null,"subject":{"digest":"sha256:a6a6a6a6a6a6a6a6a6a6a6a6a6a6a6a6a6a6a6a6a6a6a6a6a6a6a6a6a6a6a6a6","identifier":"private-match-synthetic-public-release-fixture","type":"build-artifact","version":"0.1.0"},"supersedes":null,"valid_from":"2026-08-01T00:00:00Z","valid_until":"2027-08-01T00:00:00Z"}