{"assumptions":[],"evidence":["PM-EVIDENCE-6001","PM-EVIDENCE-6003"],"id":"PM-CLAIM-6002","limitations":["PM-LIMITATION-6001","PM-LIMITATION-6002"],"owner":"ITDO Inc.","record_type":"claim","reviewers":["synthetic-fixture-reviewer"],"schema_version":"0.1","scope":"Closed fixture bundle path, digest, and derived-report linkage.","statement":"The synthetic fixture bundle file digests and report linkage are complete under the Draft 0.1 profile.","status":"supported","status_reason":null,"subject":{"digest":"sha256:a6a6a6a6a6a6a6a6a6a6a6a6a6a6a6a6a6a6a6a6a6a6a6a6a6a6a6a6a6a6a6a6","identifier":"private-match-synthetic-public-release-fixture","type":"build-artifact","version":"0.1.0"},"supersedes":null,"valid_from":"2026-08-01T00:00:00Z","valid_until":"2027-08-01T00:00:00Z"}