{"assumptions":[],"evidence":["PM-EVIDENCE-6001"],"id":"PM-CLAIM-6001","limitations":["PM-LIMITATION-6001","PM-LIMITATION-6002"],"owner":"ITDO Inc.","record_type":"claim","reviewers":["synthetic-fixture-reviewer"],"schema_version":"0.1","scope":"Mechanical verification of the catalogued test-only fixture bundle.","statement":"The synthetic fixture bundle signature verifies under the supplied fixture trust root.","status":"supported","status_reason":null,"subject":{"digest":"sha256:a6a6a6a6a6a6a6a6a6a6a6a6a6a6a6a6a6a6a6a6a6a6a6a6a6a6a6a6a6a6a6a6","identifier":"private-match-synthetic-public-release-fixture","type":"build-artifact","version":"0.1.0"},"supersedes":null,"valid_from":"2026-08-01T00:00:00Z","valid_until":"2027-08-01T00:00:00Z"}